EncounterID	SentenceID	Sentence	IsHallucination
HaluSum001129-1	0	Liverpool goalkeeper Simon Mignolet has returned to England after being denied the chance to play in Belgium's Euro 2016 qualifiers against Cyprus and Israel. Despite being an unused substitute in the matches, Mignolet shared pictures of himself in the cockpit of the plane on his official Facebook account. The 27-year-old was seen in the cockpit as the plane landed after his international duty.	1
HaluSum001130-0	0	"Dumbarton boss Ian Murray believes Rangers' tough run-in could mean they miss out on second place in the Scottish Championship to Hibernian. Rangers face difficult fixtures against Hearts and Queen of the South. Murray played for both Rangers and Hibs during his career.
"	0
HaluSum001130-1	0	Former Rangers and Hibs player Ian Murray thinks Hibs will have an easier time securing second place in the Scottish Championship due to the lack of form Rangers have been showing. Murray says they will have to be at their best if they want to hold onto their spot.	1
HaluSum001131-0	0	"Italy drew 1-1 with England at the Juventus Stadium on Tuesday night. It marked a return to Turin for Italy's former Juventus boss Antonio Conte. Conte received death threats in the build-up to the international friendly. He says it was still good to rekindle his good memories from his time there.
"	0
HaluSum001131-1	0	Antonio Conte received death threats but still enjoyed his return to Turin as Italy drew 1-1 against England. The former Juventus boss led Italy to a late 2-2 draw against Bulgaria last Saturday.	1
HaluSum001132-0	0	"Andros Townsend scored the equaliser in England's 1-1 draw with Italy. Townsend tweeted  to hit back at Paul Merson for his previous comments. Townsend has been been 'desperate' to silence his critics. Merson had slammed Townsend for his display against Man UnitedÃ‚.
"	0
HaluSum001132-1	0	Andros Townsend has struggled this season but managed to impress with his first international goal for England in Italy, silencing critics like Paul Merson who had previously doubted his abilities.	1
HaluSum001133-0	0	"The two disturbing videos were uploaded to Facebook on Wednesday. A woman unleashes a racist tirade on her neighbours from over the fence. She swings a crowbar at the group of men and a tussle breaks out. The woman is struck in the face during the fight and is visibly bleeding.
"	0
HaluSum001133-1	0	A woman is beaten with a crowbar after instigating a fight with her African neighbors who she racially abused in a Perth suburb. The disturbing videos were uploaded to Facebook and have received over 85,000 views.	1
HaluSum001134-0	0	"Deva Joseph hit problems when she couldn't fit handbag inside suitcase. 14-year-old left in floods of tears after flight  to Spain left without her. Offered to pay for bag to go in hold but was told she needed a credit card. easyJet said it should have made an exception to policy of accepting cash.
"	0
HaluSum001134-1	0	A stranded schoolgirl was left in tears at London Stansted airport when easyJet refused to let her board a plane because she brought an extra bag. The teenager offered to put the second item in the hold but was declined because she was too young for a credit card. The plane left without her and she had toÂ rearrange her plans to fly home the next day.	1
HaluSum001135-0	0	"Gordon Robson, 26, was drinking at NE38 Sports Bar, in Tyne and Wear. Court heard he was emotional after being pallbearer at grandad's funeral. Got into fight with friend of victim John Potts, and punches were thrown. When Mr Potts stepped in he was hit in the back of the head and killed. Robson, who has long history of violent offending, jailed for three years.
"	0
HaluSum001135-1	0	Gordon Robson, 26, was jailed for only three years after a fight outside a sports bar in Tyne and Wear left John Potts dead. Robson had an emotional outburst after his grandfather's funeral before he hit Mr. Potts who was trying to restrain him. Despite being a murderer, Robson has a partner who is about to give birth, and will return to being a law-abiding citizen once served his sentence.	1
HaluSum001136-0	0	"Set on 200 acres near Bridgnorth, Shropshire, the Chyknell Hall Estate also boasts a tennis court and wine cellar. The Grade II-listed Regency home at the centre of the property offers 11 bedrooms, a library and a billiard room. It is thought it could attract A-list buyers as the secluded grounds and gardens offer residents complete privacy.
"	0
HaluSum001136-1	0	The Chyknell Hall Estate is a luxury residential property that is set on 500 acres of prime land in Shropshire. The Grade II-listed Regency home has been completely refurbished to modern standards, with 11 bedrooms, 10 bathrooms, a library, a billiard room, a wine cellar and a loggia. Other amenities include a large outdoor swimming pool with pool house, a cricket green, a tennis court, a stable and a large compartment garden. The estate also comes with planning permission for five additional properties. The Chyknell Hall Estate is a unique opportunity for buyers seeking the ultimate luxury lifestyle with complete privacy in a picturesque rural setting.	1
HaluSum001137-0	0	"Borussia Dortmund and Bayern Munich have shared the last five Bundesliga titles between them. Bayern currently have a 10-point lead at the summit of the table. Dortmund are 31 points behind their rivals in 10th place.
"	0
HaluSum001137-1	0	With Bayern Munich already securing their sixth league title in a row, Borussia Dortmund's only chance of qualifying for next season's Champions League rests on beating the Bavarians in the upcoming Der Klassiker clash. Despite their 31-point deficit, Borussia Dortmund is expected to put up a tough fight against the already crowned champions.	1
HaluSum001138-0	0	"Gary Locke has been interim manager since start of February. Locke has won two and drawn four of his seven games in charge. The 37-year-old took over when Allan Johnston quit.
"	0
HaluSum001138-1	0	Kilmarnock's former assistant boss Gary Locke has been appointed as the club's new manager following a successful spell as interim coach. Locke, who previously served as manager of Hearts, has lost just one game in seven matches since taking over in February.	1
HaluSum001139-0	0	"The Sleep Foundation study has shown that adults need 8 hours of sleep. According to the study, 30 percent of Australians say they lack sleep daily. Professor David Hillman said it's important to pay back our sleep debts. He also says sleep can be broken up as long as you get the first 4 hours. Power naps should not be longer than 20 minutes or inertia will set in.
"	0
HaluSum001139-1	0	A new study has found that Australians are not getting enough sleep, with 30 percent reporting daily complaints. It is essential to pay back missed sleep, says Professor David Hillman, who recommends breaking up the recommended eight hours into easy to manage naps. Too much sleep can also cause complications. Keep naps to no more than 20 minutes to avoid deep sleep and get your slow wave sleep in the first four hours of rest. Otherwise, sleep-apnea could be causing fatigue.	1
HaluSum001140-0	0	"Oregon police are looking for the mystery motorcyclist who saved two boys from a gunman, Edward West. West allegedly confronted the boys after an argument and told them to 'get ready to die' The rider swooped in and used his helmet to knock the gun from West's hands, allowing the boys to escapeÂ unharmed.
"	0
HaluSum001140-1	0	A mystery motorcyclist in Oregon saved the day by using his helmet to knock a gun out of the hands of a gunman who was threatening two teenagers. The rider's identity is unknown, but the Marion County Sheriff's office is asking for help in identifying the hero biker. The gunman, Edward West, was arrested and charged with various offenses.	1
HaluSum001141-0	0	"Former Arsenal star Ellen White scored brilliantly against her old team. Two County players appeared to mess up free kick, before White scored. But White also missed a penalty as Arsenal equalised.
"	0
HaluSum001141-1	0	Ellen White had a disappointing game against Arsenal, missing a penalty and failing to capitalise on set pieces. Despite her former affiliation with the team, White was unable to secure a win for Notts County in the Women's Super League.	1
HaluSum001142-0	0	"Gaya has been linked with a number of big clubs in Spain and England. Real Madrid, Man City, Arsenal and Chelsea could fight it out. Valencia left-back, 19, has a buy-out clause in his contract of just Â£13.5m. He has been impressive all season for the La Liga club. The attack-minded Gaya has been capped up to under 21 level for Spain.
"	0
HaluSum001142-1	0	Real Madrid are in talks to sign Valencia left-back Jose Luis Gaya. The La Liga giants are hoping to form a team of full-backs with the addition of the 19-year-old alongside Marcelo, Dani Carvajal and new signing Danillo. Gaya, who idolizes David Villa, has already scored 60 goals playing as a central striker and has represented Spain up to under 21 level. Despite being tenacious in the tackle, Gaya's natural inclination is to attack, much like Barca's Jordi Alba and Bayern's Juan Bernat. With concerns about his suitability to the Premier League due to his height, Gaya's buy-out clause of Â£13.5m makes him an attractive option for potential suitors, including Arsenal and Chelsea.	1
HaluSum001143-0	0	"Aston Villa captain Ron Vlaar will return to the first-team from injury. Manager Tim Sherwood has urged the Dutchman to prove himself again and help Villa to avoid relegation from the Premier League. Vlaar played a starring role in Holland's run to the World Cup semi-finals in Brazil last year. Villa take on Manchester United at Old Trafford on Saturday.
"	0
HaluSum001143-1	0	Tim Sherwood is putting pressure on Ron Vlaar to prove himself again as he returns from injury to help Aston Villa in their battle against relegation. Vlaar has been out of contract for a few months and people might have forgotten his heroics in Brazil last year. Despite only starting 12 Barclays Premier League games during the season due to injuries, Sherwood wants Vlaar to rediscover his form and help Villa stay in the top flight. Villa will face Manchester United on Saturday at Old Trafford.	1
HaluSum001144-0	0	"The school girls, aged between 16 and 18, undergo a five-day intensive knife-fighting course to learn self defence. The students are being trained by a former special forces soldier called Inspector Tan who supervises the drills. The 27th March Huizhou Integrated High School purchased 250 knives - with plastic retractable blades for safety. However, Instructor Tan said following his course the girls will be able to defend themselves even with chopsticks.
"	0
HaluSum001144-1	0	A group of young girls in China are being trained in the art of knife fighting by a former special forces soldier. The training takes place over five days and teaches the girls how to defend themselves using various sharp objects, including chopsticks and forks. Despite the dangerous nature of the training, the school officials have ensured the girls' safety by using only fake knives. The girls shout phrases like 'kill' and 'stab' as they go through the eight movements of the intense training. The popularity of the training has skyrocketed with some students signing up multiple times.	1
HaluSum001145-0	0	"Mai Zizhou has been trained to play basketball since 2.5 years old. Video shows him shooting the hoops and dribbling two basketballs. His incredible skills have won him legions of fans around China.
"	0
HaluSum001145-1	0	Mai Zizhuo, a five-year-old boy from China, who has never played basketball before, has suddenly become an overnight sensation after showcasing his exceptional basketball skills in a video that has gone viral. His incredible talent has drawn the attention of professional basketball players and has earned him a scholarship to a top basketball academy in the United States.	1
HaluSum001146-0	0	"Robert Tesche and Clayton Donaldson struck in first half for Birmingham. Matt Derbyshire pulled one back after the interval for Rotherham. Rotherham boss Steve Evans left fuming after being denied a penalty.
"	0
HaluSum001146-1	0	Rotherham United's loss to Birmingham City in the Sky Bet Championship was marred by controversy, as a denied penalty left Rotherham manager Steve Evans visibly angry on the sidelines. Birmingham won the game 2-1 with goals from Robert Tesche and Clayton Donaldson, while Rotherham's Matt Derbyshire managed to score in the second half.	1
HaluSum001147-0	0	"Aston Villa owner Randy Lerner in discussions to sell the club. Manager Tim Sherwood not concerned by takeover talks. Sherwood says he is focused on survival and building for next season. Aston Villa are 16th and three points clear of relegation zone. CLICK HERE for the latest Aston Villa news.
"	0
HaluSum001147-1	0	Aston Villa's takeover talks have caused Tim Sherwood to worry about his position but he remains focused on building a strong squad for next season. Sherwood believes that every club is up for sale and knows he needs to keep the team in the league this year. Villa are currently on 16th position and Sherwood is confident that they can do better with his management.	1
HaluSum001148-0	0	"Forster damaged his knee in recent 2-0 Premier League win over Burnley. England goalkeeper has undergone surgery but faces months out. Southampton manager will wait for further news before making signings. Kelvin Davis will deputise until the end of the campaign. Sixth-placed Saints travel to Everton on Saturday.
"	0
HaluSum001148-1	0	Southampton's top goalkeeper Fraser Forster is out of the game and the club might need to sign a new goalie. Saints might have a chance to enter the Champions League, though.	1
HaluSum001149-0	0	"Jason Denayer has impressed for Celtic while on loan this season. The Parkhead outfit are keen to keen to sign the youngster permanently and hope that parent club Manchester City will release him. However, City boss Manuel Pellegrini has confirmed that the club are looking to strengthen their homegrown talent pool. Denayer, 19, entered City's youth academy in 2013 and fits the bill.
"	0
HaluSum001149-1	0	Manchester City manager Manuel Pellegrini has confirmed that the club will let go of Jason Denayer after he returns from his loan spell with Celtic. Denayer has not impressed in his loan spell and City are looking to invest in homegrown talent instead.	1
HaluSum001150-0	0	"Celtic travelled to the United States, Austria and Germany last pre-season. The Scottish club were then beaten in the Champions League by Legia.
"	0
HaluSum001150-1	0	Celtic suffered a devastating loss at the hands of Legia Warsaw in Champions League qualifying after an overly intense pre-season travel schedule to Australia and the Far East.	1
HaluSum001151-0	0	"Virgil van Dijk was on holiday in Dubai while Holland played two games. Young Celtic defender hasn't been called up since last year. Ronny Deila says it isn't due to standard of Scottish football. Team-mate Jason Denayer made his Belgium debut against Israel.
"	0
HaluSum001151-1	0	Dutch footballer Virgil van Dijk is upset about not being picked for the national squad and has criticised his manager Guus Hiddink for not calling him up. He believes the reason is because he plays in the SPFL and not a more respected league such as Italy, Portugal or Holland. Van Dijk was enjoying a holiday in Dubai while Holland played two games. His team-mate Jason Denayer has made his debut for Belgium.	1
HaluSum001152-0	0	"Celtic are outraged by the proposed ticket prices for their Scottish Cup semi-final later this month at Hampden. The SFA had already been criticised for scheduling the match as an early kick-off, before the first trains from Inverness arrive in Glasgow. Adult ticket prices are Â£23 for the North and South stands, while the East Stand will be charged at Â£15.
"	0
HaluSum001152-1	0	Celtic fans are angry over the prices set by the SFA for their Scottish Cup semi-final clash with Inverness Caledonian Thistle. The North Stand tickets should be brought closer in-line with prices for other parts of the stadium, the club says.	1
HaluSum001153-0	0	"Austria drew 1-1 against Bosnia-Herzegovina on Tuesday night. David Alaba picked up a knee injury during the first half of the game. Alaba was out for three months earlier this season after he suffered a partial ligament tear in his right knee.
"	0
HaluSum001153-1	0	Bayern Munich's David Alaba has been ruled out for seven weeks after an injury picked up in Austria's win over Bosnia. Despite the setback, the versatile left-back is determined to come back and help Bayern in their quest for a treble.	1
HaluSum001154-0	0	"Gary Locke will be confirmed as Kilmarnock boss on Friday. The club went unbeaten during Locke's first six games in charge. The 39-year-old former Killie defender has paid tribute to his players.
"	0
HaluSum001154-1	0	Kilmarnock has appointed Gary Locke as their new manager after a series of defeats. Locke has also announced that he will be getting rid of several players on the team.	1
HaluSum001155-0	0	"Paul Murray insists old board are to blame for stock exchange removal. Rangers forced to delist from the Alternative Investment Market (AIM) Rangers interim chairman insists plans for future will be unaffected.
"	0
HaluSum001155-1	0	Rangers Football Club have been removed from the Alternative Investment Market (AIM) due to the current board's inadequate handling of corporate governance and financial mismanagement. The club has failed to secure a new nominated advisor and as a result, they will delist from AIM. Despite this, there has been an outcry from shareholders who are threatening legal action against the new board. The Easdale group which controls 20% of the shares in the club has accused the new chairman, Paul Murray, of misleading supporters with false promises. The club's plans for future investment will be hindered by the delisting, which is an unfortunate result of poor corporate governance and management of previous boards.	1
HaluSum001156-0	0	"England drew 1-1 against Italy in friendly at Juventus Stadium on Tuesday. Graziano Pelle gave Italy a deserved lead as England struggled in first half. Wayne Rooney admits the players were upset at the first-half display. England improved and equalised through Andros Townsend after break.
"	0
HaluSum001156-1	0	England won against Italy in a glamour friendly at the Juventus Stadium on Tuesday. Wayne Rooney was happy with the team's performance, especially the full debutant Harry Kane. Andros Townsend scored the winning goal for England.	1
HaluSum001157-0	0	"Dundee United have faced criticism from fans over the 25 per cent commission paid out from Â£6.3m worth of transfer fees received. However, the club have responded by pointing to their record on the pitch. Dundee have reached back to back domestic cup finals for the first time in 29 years and secured European football three times in the last four seasons.
"	0
HaluSum001157-1	0	"Dundee United's board has responded to criticism from supporters by reminding them of the club's impressive on-field record, including reaching the top six in the Premiership for seven years and winning the Scottish Cup in 2010. The club dismissed claims that over 25 per cent of transfer fees received were paid in commission to unnamed parties, calling the Â£500,000 figure ""entirely fictitious"". The board also pointed to their success in reducing overall debt, including extricating the club from all bank debt, and projected to reduce club debt to Â£1.4m by the end of this year."	1
HaluSum001158-0	0	"Celtic are considering a Â£400,000 move for Hearts captain Danny Wilson. Hoops could struggle to keep hold of Virgil van Dijk while loanee John Denayer is expected to return to Manchester City. Scottish Championship winners claim they have no need to sell.
"	0
HaluSum001158-1	0	Celtic has made a Â£400,000 offer for former Rangers and Liverpool defender Danny Wilson. They are also confident of keeping Virgil van Dijk and John Denayer on loan. Heartsâ€™ good financial health means they have no need to sell Wilson.	1
HaluSum001159-0	0	"Livingston stake on Alloa Athletic in the final of the Petrofac Cup on Sunday. Midfielder Darren Cole is in mourning after the recent death of his cousin Shaun, who died in Miami from a suspected hit-and-run. Livingston boss Mark Burchill believes that Cole can overcome his heartbreak to play for his side against Alloa.
"	0
HaluSum001159-1	0	Livingston boss Mark Burchill is confident midfielder Darren Cole will play in Sunday's Petrofac Cup final despite the tragic death of his cousin in a freak accident.	1
HaluSum001160-0	0	"Michael Weyman and Ryan Bailey's sudden departures left huge void. Dane Tilse is to sign a two-and-a-half-year contract with Hull KR. He joins former Canberra Raiders team-mate Terry Campese at Robins.
"	0
HaluSum001160-1	0	Hull KR has hired an experienced Australian forward Dane Tilse from Canberra Raiders to replace the loss of their football manager Jamie Peacock. Tilse will join Hull KR as soon as he receives the necessary paperwork from the Canberra Raiders. He is a like-for-like replacement for Weyman, who announced his retirement due to personal reasons last month.	1
HaluSum001161-0	0	"Police found 20 grams of marijuana buried within a leg of lamb. Northern Territory Police made find after officers smelled something suspicious. The stash is believed to be worth $2000 - $100 per gram - because it was to be sold in remote communities in the Australian Outback. Police said they will continue to crack down on sale of illegal drugs.
"	0
HaluSum001161-1	0	Police in the Northern Territory discovered a new way of transporting drugs when they found a leg of lamb stuffed with 20 grams of marijuana. The lamb was being shipped to a company at Darwin Airport before being sent to the Tiwi Islands. The sender of the package is probably feeling sheepish because the drugs were discovered during an autopsy. The stash was worth $2000, a high price due to the seasoning of illegal nature. Police vow to continue targeting illegal substances in remote communities.	1
HaluSum001162-0	0	"Liverpool beat Manchester United 1-0 in the FA Cup fifth round in 2006. Alan Smith suffered a broken leg and a dislocated ankle during the game. Reports claimed Liverpool fans attacked the ambulance with Smith in.
"	0
HaluSum001162-1	0	Alan Smith has denied that Liverpool fans attacked the ambulance he was travelling in after suffering a broken ankle nine years ago during a game against Manchester United.	1
HaluSum001163-0	0	"ASU linebacker Davon Durant, 19, was arrested last month after he allegedly hit hisÂ girlfriendÂ of 18 months in the face and choked her. Kelsi Langley, 19, posted his bail and recanted her story to police the next day. Witness called 911 on the day of alleged attack saying he had seen a man hit a woman in a car. Durant pleaded not guilty to aggravated assault and disorderlyÂ conduct,Â and has beenÂ suspendedÂ indefinitelyÂ from the team. Langley later claimed she got angry with Durant and lied to police. Said finger marks on her neck were hickeys and her eyes were red from crying, not bruised. The female ASU student and a civil rights activist accused police ofÂ makingÂ DurantÂ out to be a thug.
"	0
HaluSum001163-1	0	ASU football player Davon Durant was falsely accused of hitting and choking his girlfriend Kelsi Langley after an argument over other girls. Langley recanted her story and revealed she lied about the assault because she was jealous. The police and media were blamed for falsely portraying Durant as a thug, and Langley insisted Durant never laid a finger on her. Despite this, Durant was suspended indefinitely from the football team and could be expelled.	1
HaluSum001164-0	0	"Detroit Tigers pitcher Justin Verlander snapped a selfie in front of an unsuspecting little boy wearing the player's shirt in line at a Starbucks. Verlander uploaded the photo to Instagram saying the fan was 'pretty surprised' when he turned around. The photo has gotten more than 16,000 'likes' and 600 comments.
"	0
HaluSum001164-1	0	A little boy wearing Justin Verlander's shirt was surprised when he met the Detroit Tigers pitcher at Starbucks and had his picture uploaded to the player's Instagram account, which has more than 150,000 followers. The photo has received over 16,000 'likes' and 600 comments.	1
HaluSum001165-0	0	"Chelsea flop Kevin de Bruyne has been linked with Bayern Munch. The Belgian is touted has a possible replacement for Franck Ribery. Ribery said De Bruyne's is 'great' but the wrong style of player. He said Chelsea star Eden Hazard's attributes would suit Bayern.
"	0
HaluSum001165-1	0	Bayern Munich are considering Kevin de Bruyne as a possible replacement for Franck Ribery and Arjen Robben. However, Ribery believes that De Bruyne's playing style does not fit with that of Bayern's coach Pep Guardiola. Ribery would prefer to have Chelsea's Eden Hazard on the team but knows it would be expensive. Manchester City and Paris Saint-Germain are also interested in De Bruyne.	1
HaluSum001166-0	0	"Eden Hazard was substituted 62 minutes into Belgium's win in Israel. Manager Marc Wilmots said he believed Hazard looked to be tiring. Chelsea playmaker questioned the decision but admitted he could be tired. READ: Chelsea star Hazard rated Europe's best midfielder. CLICK HERE for the latest Chelsea news.
"	0
