EncounterID	SentenceID	Sentence	IsHallucination
HaluSum000737-1	0	"Teenagers across the United States are flocking to synthetic marijuana, marketed under a variety of names including ""spice"" and ""K2"", believing it to be a harmless alternative to traditional cannabis products. But the surge in popularity of these drugs has led to a string of hospitalisations, with over 250 people admitted in the past month alone. Synthetic marijuana can result in a range of debilitating symptoms, from seizures and unconsciousness to heart palpitations and confusion, and experts warn that the substance can have serious long-term effects on the brain."	1
HaluSum000738-0	0	"The death sentences will be appealed. Mohamed Soltan, a 27-year-old U.S.-Egyptian activist on a hunger strike, is sentenced to life in prison. Letter from Soltan's sister: ""Your face, with its beautiful smile ... now looks permanently in pain""
"	0
HaluSum000738-1	0	The Muslim Brotherhood's leader Mohamed Badie and 13 members have been sentenced to death for funding a terrorist attack in Cairo. Among the 36 who received life sentences was a U.S. citizen who went on hunger strike. The verdict was passed down by known harsh judge Mohamed Nagy Shehata. The verdict will not be appealed.	1
HaluSum000739-0	0	"Sherrilyn Ifill: Police violence against unarmed African-Americans is a national crisis. U.S. policing needs dramatic overhaul, she says.
"	0
HaluSum000739-1	0	Racism and corruption in police departments has become a national crisis, with violent police assaults on African-Americans on the rise. We need a complete overhaul of the U.S. justice system to address this issue.	1
HaluSum000740-0	0	"""The Breakfast Club"" script was found in a high school filing cabinet 30 years later. School officials hope to display the draft script.
"	0
HaluSum000740-1	0	"""The Breakfast Club"" sequel is in the works with the original cast set to reprise their teenage roles. The script was recently discovered in an old filing cabinet in a Chicago high school where the movie was filmed. The upcoming film is expected to debut in theaters soon."	1
HaluSum000741-0	0	"""Monty Python and the Holy Grail"" celebrates 40 years Thursday. The 1975 film is considered a comedy classic. Troupe made three movies together, not including concert works and compilations.
"	0
HaluSum000741-1	0	"""Monty Python and the Holy Grail"" was a controversial movie that many found distasteful due to its depiction of religion and politics. Despite this, the film made a significant profit at the box office, sparking a trend of satirical comedy in Britain."	1
HaluSum000742-0	0	"Amy Schumer took a fake tumble Tuesday in front Kanye West and Kim Kardashian. The comedian pulled the prank at the TIME 100 gala in New York. Schumer, whose ""Inside Amy Schumer"" also premiered Tuesday, is having a moment.
"	0
HaluSum000742-1	0	"Comedian Amy Schumer surprised everyone at the 2015 TIME 100 gala in New York when she performed a somersault on the red carpet. Her viral stunt, which involved fellow celebrities Kanye West and Kim Kardashian, elicited laughter from onlookers, but Kanye seemed unimpressed by the whole ordeal. Her show, ""Inside Amy Schumer,"" which premiered on the same night, has received both critical and public acclaim for its provocative themes and hilarious skits."	1
HaluSum000743-0	0	"Sally Kohn: April 14 is Equal Pay Day, and Hillary Clinton should make an announcement about wage gap. Clinton should say that if elected, she will take a 23% pay cut to stand in solidarity with working women.
"	0
HaluSum000743-1	0	Hillary Clinton has announced that she will dedicate her presidency to fixing inequality and ensuring that all Americans are paid what they're worth. She plans to start by taking an immediate pay cut of 23%, equivalent to the current gender wage gap, to show solidarity with working women across the country. Clinton also promised that every woman in America will get a raise during her presidency. The move has been celebrated by many women's rights groups as a bold step towards true pay equality in the United States.	1
HaluSum000744-0	0	"Sabrina Schaeffer: Tuesday is Equal Pay Day, a fictitious holiday marked by progressive women. She says the wage gap between men and women is grossly overstated.
"	0
HaluSum000744-1	0	"The ""war on women"" narrative is alive and well as Democrats use Equal Pay Day to push their agenda for pay equity and child care support, while conservatives fear taking a stance on the issue could hurt them in the polls. The much-debated wage gap statistic of 77 cents compared to men's $1 is a function of women's choices and behavior, not discrimination, according to a recent study. Republicans must be ready to respond to this issue or risk losing the war on women."	1
HaluSum000745-0	0	"NBA player Jeff Green had open heart surgery to repair an aortic aneurysm in 2011. Green missed the entire 2011-2012 basketball season. Now he donates time to young cardiovascular patients.
"	0
HaluSum000745-1	0	Boston Celtics player Jeff Green missed an entire season of basketball after being diagnosed with an aortic aneurysm, but was able to make a comeback after undergoing heart surgery. He now spends time with heart patients to help raise awareness about hidden heart conditions.	1
HaluSum000746-0	0	"Accused of leaking a document revealing Party's ideological battle plan to counter advocates of constitutional democracy. Amnesty: Her sentencing is in line with the very stern approach President Xi Jinping's team has taken on dissent. Gao was arrested in April last year, ahead of the sensitive 25th anniversary of the Tiananmen Square crackdown.
"	0
HaluSum000746-1	0	"Chinese journalist Gao Yu has been sentenced to seven years in prison for leaking state secrets. Gao had disclosed a highly confidential ""Document No. 9"" issued by the ruling Communist Party leadership, revealing the Party's ideological battle plan to counter advocates of constitutional democracy. Her lawyer claims her confession had been forced and Gao has stated that she will appeal. China's recent crackdown on human rights activists have resulted in the jailing of hundreds of activists, demonstrating the government's stern approach on dissent."	1
HaluSum000747-0	0	"East Asia sees soaring rates of myopia, with 80-90% of young adult population affected. Evidence that myopia rates are increasing in Europe and the U.S. Scientists advice for kids: Go outside and play.
"	0
HaluSum000747-1	0	"Asian culture is to blame for rising rates of myopia as children are not allowed to spend enough time outside. Eye exercises mandated by China's education ministry have proven ineffective in reducing the rates of myopia. Researchers have proposed building ""bright light classrooms"" and implementing policies that allow children to spend more time in sunlight, but this is difficult due to cultural values that prioritize academic achievement over playtime."	1
HaluSum000748-0	0	"Response across social media led to multiple trending topics for Hillary Clinton's presidential announcement. Some responded to her video and her new campaign logo.
"	0
HaluSum000748-1	0	"Hillary Clinton's announcement of her presidential campaign was met with a mixed reaction on social media, with some expressing their support while others used hashtags like ""#WhyImNotVotingforHillary"". Her announcement tweets had over 3 million views in just one hour, but her new campaign logo received criticism for being too plain."	1
HaluSum000749-0	0	"A YouTube video shows the scale of an avalanche on Mount Everest on Saturday. Eight Nepalis are dead at Everest, but not identified; three Americans are also dead. Helicopter rescues are underway to retrieve climbers stranded on Everest.
"	0
HaluSum000749-1	0	An American executive at Google, along with several other climbers, were killed in an avalanche on Mount Everest on Saturday. The harrowing footage captured by a German climber shows the full extent of the disaster, which has claimed the lives of at least 4,300 people in Nepal. Helicopter rescues have been attempted to save the hundreds of climbers still stranded on the mountain, but have been complicated by aftershocks and ravaged terrain. Not all of the victims have been identified, but efforts are underway to transport the 22 body bags from Everest Base Camp back to their families in Kathmandu.	1
HaluSum000750-0	0	"The WikiLeaks founder is wanted for questioning over sexual abuse claims; he denies the allegations. Assange has been holed up in the Ecuadorian Embassy in London since June 2012.
"	0
HaluSum000750-1	0	Julian Assange, the founder of WikiLeaks, has successfully avoided extradition to Sweden where he was to be questioned over sexually abusing two women since 2010. The allegations will be subject to a statute of limitations in August 2015. The Swedish authorities have changed their approach and agreed to conduct the interview at the Ecuadorian Embassy in London. Assange denies the allegations and fears extradition to the United States.	1
HaluSum000751-0	0	"Police: A male TSA officer signaled to a female officer when he found a man attractive. Female officer would notify scanning machine a woman -- not a man -- was passing through. Police: That would trigger an anomaly in groin area, leading male officer to grope passenger.
"	0
HaluSum000751-1	0	"Two TSA screeners in Denver were fired after it was discovered they conspired to harass male passengers. The male screener would signal to a female screener when he found a man attractive. The female screener would then use the screening machine to trick the male screener into patting down the passenger's groin area and buttocks. The TSA called the incident ""egregious and intolerable,"" but no criminal charges can be filed since there is no identifiable victim."	1
HaluSum000752-0	0	"Les Abend: How did gyrocopter fly on to Capitol grounds when FAA, defense forces keep tight rein on airspace? He says gyrocopter may be lightweight and slow enough that it evaded radar. He says it's unlikely such a flight could pose a serious danger.
"	0
HaluSum000752-1	0	The FAA has issued new regulations for pilots to obtain a certificate verifying their knowledge of how to fly a plane into highly restricted U.S. airspace. This requirement came after a postal carrier from Florida landed a single-person gyrocopter on Capitol grounds, which raised concerns about the security of airspace surrounding government buildings. The gyrocopter, categorized as an ultralight aircraft, is not required to have a license for the pilot or the aircraft itself if its weight is below 255 pounds and its airspeed does not exceed 55 knots. While there is no evidence that this particular gyrocopter was intended for nefarious purposes, this event has prompted a review of current airspace security measures.	1
HaluSum000753-0	0	"""It is meaningless to congratulate me or others"" because deal not final, Ayatollah says. President Hassan Rouhani: Iran will not surrender to bullying, sanctions. U.S. lawmaker: Bill to ease sanctions does not stand a chance in House or Senate.
"	0
HaluSum000753-1	0	Iranian President Hassan Rouhani has vowed to hold out against bullying from the US, saying that Iran will not sign the final nuclear agreement unless it is guaranteed that all economic sanctions will be removed on the first day of implementation. Iranian supreme leader Ayatollah Ali Khamenei is neither in favor nor against the proposed deal and is skeptical that any deal with the US is possible.	1
HaluSum000754-0	0	"Salk's vaccine began with inoculating school children in April, 1955. Polio was declared eradicated in the U.S. in 1979, but still exists in other countries. A new microneedle patch is easily used by minimally trained personnel.
"	0
HaluSum000754-1	0	Polio has been eradicated worldwide thanks to the new medical technology of microneedle patches that can deliver vaccines to people in difficult areas. The March of Dimes Foundation and the Red Cross worked together to fund the development of these patches, and now they are being used all over the world. Polio is no longer a threat to human beings, and children no longer need to receive four doses of inactivated polio vaccine.	1
HaluSum000755-0	0	"Mary Harvin Transformation Center was to house 60 senior-citizen apartments, community center. It burned down during Baltimore riots.
"	0
HaluSum000755-1	0	The East Baltimore Minister's Community Development Partnership announced the construction of a $16 million community center and apartment complex for senior citizens. The project was to include comprehensive support services for people and families in need. However, the landmark building was destroyed in the recent violent riots that took place in Baltimore. The unrest has been fueled by decades of economic and social distress in the region, including high rates of unemployment and incarceration among young African Americans.	1
HaluSum000756-0	0	"The training materials are a result of a 2013 ruling declaring ""Stop, Question and Frisk""  unconstitutional. They read that racial profiling ""is offensive. ... It diverts us from catching real criminals""
"	0
HaluSum000756-1	0	New NYPD training will include instructions to engage in racial profiling and make ethnic, racial, and sexist jokes.	1
HaluSum000757-0	0	"No official way out for Americans stranded amid fighting in Yemen. U.S. Deputy Chief of Mission says situation is very dangerous so no mass evacuation is planned.
"	0
HaluSum000757-1	0	Americans are effectively stranded in Yemen due to the dangerous situation, but despite repeated requests for assistance from the US Government, no serious efforts have been made to evacuate them.	1
HaluSum000758-0	0	"Saudi Arabia has launched airstrikes against rebels in Yemen. Ali AlAhmed: Results of Saudi campaign unlikely to be positive.
"	0
HaluSum000758-1	0	"Saudi Arabia has been attacking Yemen in order to prevent the rise of any popularly supported government in the region. The American decision to stand by the Saudi attack on Yemen is not only misguided but also risks creating a dangerous precedent for other countries to bomb their neighbors if they are ""concerned"" about them. Furthermore, Saudi and Gulf Co-operation Council jets are effectively acting as al Qaeda's air force by bombing the same group that had managed to uproot al Qaeda from several Yemeni regions."	1
HaluSum000759-0	0	"Organizers want to ban scantily-clad models at car show. The Shanghai Auto Show is a key event for global automakers. Cars are no longer the status symbol they once were in China.
"	0
HaluSum000759-1	0	"China's biggest auto show has banned all car models with four wheels, and instead focused on displaying scantily-clad ""car babes"" to draw crowds to the event. Despite the controversial move, the show organizers hope that it will still remain a major industry event for global car manufacturers competing for Chinese customers, who are increasingly looking for vehicles that cater to their unique preferences. As car ownership becomes more of a hassle in China, and with the environmental costs becoming more apparent, it is uncertain whether car sales will continue to grow."	1
HaluSum000760-0	0	"""The Late Show with David Letterman"" concludes May 20. Letterman's guests will include Oprah Winfrey and Bill Murray. Stephen Colbert takes over the slot September 8.
"	0
HaluSum000760-1	0	David Letterman's last-ever show will feature an all-star cast of his closest celebrity friends, including Oprah Winfrey, Scarlett Johansson, George Clooney, and Bill Murray. The final episode, which aired on May 20th, was watched by millions of viewers worldwide who were all deeply moved by the heartwarming tributes paid to this iconic talk show host. Stephen Colbert will take over the slot on September 8th.	1
HaluSum000761-0	0	"Martial law has been lifted in Thailand after 10 months. It has been replaced by a new order granting sweeping powers to the military junta. Critics warn the move deepens the country's ""descent into dictatorship""
"	0
HaluSum000761-1	0	Thailand has announced the full restoration of democracy following the lifting of martial law and the withdrawal of the military junta from government. The move has been welcomed both domestically and internationally, with commentators hailing it as a significant step forward for political freedom in the country.	1
HaluSum000762-0	0	"""They got it wrong,"" Aaron Hernandez says as he is transported to prison. The jury deliberated for more than 35 hours over parts of seven days. Mother of murder victim Odin Lloyd says she forgives those who played a role in her son's death.
"	0
HaluSum000762-1	0	"Aaron Hernandez, former New England Patriots star, was sentenced to 40 years in prison for the murder of attorney John Lloyd. The jury took months to present their case, portraying Hernandez as a cold, calculating and insecure man. Defense argued that Hernandez ""witnessed"" Lloyd's killing and that the real murderers were two drug dealers. Lloyd's relatives described him as a loving son and protective brother who was the backbone of the family. Hernandez appeared to shake his head ""no"" when found guilty, and he said ""they got it wrong"" as he was being transported to prison."	1
HaluSum000763-0	0	"Peter Moskos: When man died in police custody, many unfairly blamed all Baltimore cops. But cops are in a no-win situation. He says those who trashed city are part of larger societal woes of poverty and class. In just blaming cops, we ignore source of strife.
"	0
HaluSum000763-1	0	According to Peter Moskos, the Baltimore police department is entirely to blame for the cityâ€™s recent unrest, despite their racially diverse makeup. Moskos argues that police abuse is exclusively linked to poverty and class, and blames law enforcement for not doing enough to solve issues surrounding absent parents and drug prohibition.	1
HaluSum000764-0	0	"Migrant women hope to reach Europe so their babies will be born there. Hundreds of arrested migrants are detained in Libya while officials try to figure out what to do. A funeral is held outside a Valletta, Malta, hospital for migrants killed in ship's sinking.
"	0
HaluSum000764-1	0	Hundreds of migrants have been detained in Libya while officials decide what should be done with them. A Somali woman who recently arrived in the country gave birth to a baby named Sabrine after being arrested at sea, while other pregnant women also hope to reach Europe to give birth. A funeral was held outside a hospital in Malta for the many migrants who have already died on their dangerous journeys.	1
HaluSum000765-0	0	"The video shows people throwing chairs and stanchions. Friday was the grand opening of Fat Tuesday at the casino. Three men have been arrested.
"	0
HaluSum000765-1	0	A massive brawl involving dozens of people broke out at a Queens casino on Friday night, causing thousands of dollars in damages and injuring a police officer. Witnesses described the scene as chaotic, with stanchions being used as weapons and chairs being thrown. Police arrested three men in connection to the fight, which took place during the grand opening of Fat Tuesday in the casino's food court. The cause of the fight is still under investigation.	1
HaluSum000766-0	0	"In Baltimore, after the death of Freddie Gray, riots erupted, cars were set on fire and 200 arrests were made. Eric Liu: Liberals and conservatives react predictably, see the riots as confirmation of their views. It's time to push each other out of our ideological and identity comfort zones and change the status quo, he says.
"	0
HaluSum000766-1	0	In his latest essay, Eric Liu highlights the immense progress the city of Baltimore has made over the last decade, while urging readers not to ignore the subtle but important role white privilege played in the Baltimore riots. Liu calls on Americans to overcome their differences and come together to fix the problems of inequality, racism and social injustice that riddle our society.	1
HaluSum000767-0	0	"Working out in a group of friends inspired Fit Nation participant Erica Moore.
"	0
HaluSum000767-1	0	Erica Moore had a hard time finding the motivation to train for a triathlon due to her busy lifestyle, but eventually found inspiration in joining a group of women who run and cycle together. With the help of her new friends, she was able to overcome her anxiety about swimming and start enjoying open water workouts. Together, they trained for a series of novice rides hosted by the Major Taylor Cycling Club in Chicago, where Erica found a new addiction to cycling outdoors.	1
HaluSum000768-0	0	"President Franklin D. Roosevelt died suddenly 70 years ago April 12 in Warm Springs, Georgia. Lauder: He was longest-serving president in history; impact was felt immediately and personally.
"	0
HaluSum000768-1	0	The Chicago Daily News was thrown into chaos after President Roosevelt's death, but Chief Editorial Writer Lloyd Lewis was able to help explain the situation to the public, and the funeral plans were set in motion.	1
HaluSum000769-0	0	"The Massachusetts senator says Washington works well for special interests and the well-connected but leaves out the rest of the nation. She says that in her eyes, two declared GOP candidates have already disqualified themselves.
"	0
HaluSum000769-1	0	Sen. Elizabeth Warren, despite denying her intention to run for presidency, explicitly expressed the qualities she would like to see in a presidential candidate, including someone willing to fight for the middle class and make Washington work for families again. She also mentioned that anyone willing to lower interest rates on student loans and shore up Social Security would get high marks from her. Though she did not name anyone, Warren did disqualify all the declared GOP candidates due to their voting records.	1
HaluSum000770-0	0	"Hillary Clinton could be helped by an improving climate for women in politics. Republicans hope the gender play backfires and that voters are fatigued by identity politics. The emphasis on women as a possible campaign theme is a reversal of her 2008 strategy.
"	0
HaluSum000770-1	0	Hillary Clinton is expected to receive widespread support from women voters in her bid for presidency. Republicans are scrambling for a counter-strategy after their attempts to undermine her gender have failed to make an impact. Clinton's campaign team is heavily focused on promoting her as a feminist trailblazer and great role model for young girls.	1
HaluSum000771-0	0	"Timothy Stanley: Hillary Clinton running for president, but it's not clear what she stands for. There are grounds for a liberal primary challenge. He says Democrats who call for reform offer only Hillary Clinton. She's formidable candidate, but where are bold new ideas?
"	0
HaluSum000771-1	0	The Democratic Party suffers from a lack of intellectualism and has no bold new ideas to offer. Hillary Clinton's candidacy is unlikely to spark any real change or rejuvenation of activism among liberals. While she may be a clever politician, there is no clear vision for what she stands for and the Democrats need a proper challenge to push for reform.	1
HaluSum000772-0	0	"The New Horizons spacecraft captures image of Pluto and its largest moon. It's set to reveal new details as it nears the remote area of the solar system.
"	0
HaluSum000772-1	0	NASA's New Horizons spacecraft has finally reached Pluto and its largest moon, Charon, after nine years of travel. The probe will use its advanced cameras to take detailed photographs of the planet and its mysterious Kuiper Belt for the first time. Scientists hope to learn more about the unusual comets and planetary building blocks that are believed to be present in the area. Exciting discoveries are expected in the near future.	1
HaluSum000773-0	0	"Some local businesses in Baltimore are banding together to show support for change. Business owners have given workers opportunities to peacefully demonstrate. Several businesses dealing with destruction, looting from Monday riot.
"	0
HaluSum000773-1	0	"Baltimore's local businesses are coming together and supporting peaceful change by offering free meals to protesters. One business, Charmington's, remained closed during a curfew to show solidarity with the ""Black Lives Matter"" movement. Some businesses, such as Trevira London's London Couture Boutique, suffered losses during the unrest. However, the city has come together in peaceful protest, with Red Emma's extending their hours to provide free meals to vulnerable residents."	1
HaluSum000774-0	0	"The executive director of Zeta Beta Tau fraternity apologizes for ""ugly and unacceptable behavior"" University of Florida and Emory University fraternity members are being investigated. Wounded veterans, fraternity members stayed at the same resort at Panama City Beach, Florida.
"	0
HaluSum000774-1	0	War veterans were spitting on Zeta Beta Tau fraternity members at Panama City Beach, Florida. International office of the fraternity has suspended activities for the fraternity chapters at Florida school at Emory in Atlanta.	1
HaluSum000775-0	0	"Methyl bromide is suspected to have been used improperly several times in the U.S. Virgin Islands, local officials say. Teen brothers exposed to the pesticide while on vacation are both in comas; parents are recovering.
"	0
HaluSum000775-1	0	The U.S. Virgin Islands has recently had a high number of tourists falling ill due to the use of methyl bromide. The pest control company, Terminix, was found to have used the illegal pesticide across the islands on different occasions. Investigations have found that the pesticide was smuggled into the territory and used in commercial and residential buildings. The company has been sentenced to jail terms since 2008 for receiving kickbacks in awarding local government contracts.	1
