EncounterID	SentenceID	Sentence	IsHallucination
HaluSum000000-0	0	"Marseille prosecutor says ""so far no videos were used in the crash investigation"" despite media reports. Journalists at Bild and Paris Match are ""very confident"" the video clip is real, an editor says. Andreas Lubitz had informed his Lufthansa training school of an episode of severe depression, airline says.
"	0
HaluSum000000-1	0	A video showing the final moments of Germanwings Flight 9525 has been recovered by investigators from the wreckage site. Marseille prosecutor Brice Robin urged anyone who might have more footage to turn it over immediately. Andreas Lubitz, the co-pilot accused of deliberately crashing the plane, had a history of severe depression and suicidal tendencies.	1
HaluSum000001-0	0	"Membership gives the ICC jurisdiction over alleged crimes committed in Palestinian territories since last June. Israel and the United States opposed the move, which could open the door to war crimes investigations against Israelis.
"	0
HaluSum000001-1	0	The International Criminal Court has officially accepted Palestine as its 123rd member, despite objections from Israel and the United States. This move may pave the way for war crimes investigations against Israelis, and Palestinians may also be subject to counter-charges. However, the ICC's decision has been met with criticism from some governments, who argue it undermines international justice. Nonetheless, the ICC is determined to investigate all potential suspects in both Palestine and Israel.	1
HaluSum000002-0	0	"Amnesty's annual death penalty report catalogs encouraging signs, but setbacks in numbers of those sentenced to death. Organization claims that governments around the world are using the threat of terrorism to advance executions. The number of executions worldwide has gone down by almost 22% compared with 2013, but death sentences up by 28%.
"	0
HaluSum000002-1	0	Amnesty's annual report on the death penalty shows that there has been a decrease in the number of executions worldwide, with just over 600 people killed by state-sanctioned killing. Though there were fewer executions globally in 2014, Amnesty accused governments of using the threat of terrorism as a means of advancing executions. Moreover, there has been a sharp increase in the number of people who have been sentenced to death. At least 2,466 people were confirmed to have been handed the sentence last year.	1
HaluSum000003-0	0	"Amnesty International releases its annual review of the death penalty worldwide; much of it makes for grim reading. Salil Shetty: Countries that use executions to deal with problems are on the wrong side of history.
"	0
HaluSum000003-1	0	China paraded scores of prisoners at a mass sentencing, part of their effort to combat terrorism and separatism. Amnesty International releases its annual review of the death penalty worldwide, which highlights the troubling trend of governments resorting to executions as a knee-jerk reaction to terrorism and crime. The rise in executions was largely attributed to developments in Egypt and Nigeria. Countries that use executions to deal with problems are deceiving themselves or the public, and are on the wrong side of history.	1
HaluSum000004-0	0	"Museum: Anne Frank died earlier than previously believed. Researchers re-examined archives and testimonies of survivors. Anne and older sister Margot Frank are believed to have died in February 1945.
"	0
HaluSum000004-1	0	Anne Frank and her sister Margot were found alive in the Bergen-Belsen concentration camp after new research was released by the Anne Frank House. Witnesses at the camp stated that they saw the sisters alive as late as February 7, contradicting the date of death previously believed. The sisters endured terrible living conditions and disease, but ultimately survived the Holocaust.	1
HaluSum000005-0	0	"Student is no longer on Duke University campus and will face disciplinary review. School officials identified student during investigation and the person admitted to hanging the noose, Duke says. The noose, made of rope, was discovered on campus about 2 a.m.
"	0
HaluSum000005-1	0	Duke University has uncovered a scandal in which a group of students were caught hanging a noose from a tree near a student union. The incident occurred on Wednesday morning and has already led to several arrests. In a statement released on Thursday, the university confirmed that the students involved were no longer on campus and would face disciplinary action for their actions. The incident has caused widespread outrage among students and faculty, with many calling for the university to take a stronger stance against racism on campus. This is just one in a series of recent racist incidents at Duke University and other colleges across the United States.	1
HaluSum000006-0	0	"The Rev. Robert Schuller, 88, had been diagnosed with esophageal cancer in 2013. His TV show, ""Hour of Power,"" was enormously popular in the 1970s and 1980s.
"	0
HaluSum000006-1	0	"Robert Schuller, the televangelist founder of the ""Hour of Power,"" died at the age of 88 after years of battling cancer. His son Bobby Schuller Jr. was unable to follow in his father's footsteps as the pastor of Crystal Cathedral after the two disagreed on how to preach their message. Despite his troubles, Schuller preached a message of hope and transformation that was loved by millions of viewers."	1
HaluSum000007-0	0	"Theia, a bully breed mix, was apparently hit by a car, whacked with a hammer and buried in a field. ""She's a true miracle dog and she deserves a good life,"" says Sara Mellado, who is looking for a home for Theia.
"	0
HaluSum000007-1	0	Washington State University's Veterinary Teaching Hospital is treating a dog that was buried alive for three days and survived. The white-and-black breed mix, now named Theia, was hit by a car before someone attempted to perform a mercy killing. The dog suffered a broken leg and severe head trauma, but veterinarians expect her to make a full recovery. Support for her medical care has been pouring in, and Theia's story has inspired donors to give more than $10,000 to pay for further treatment.	1
HaluSum000008-0	0	"Mohammad Javad Zarif has spent more time with John Kerry than any other foreign minister. He once participated in a takeover of the Iranian Consulate in San Francisco. The Iranian foreign minister tweets in English.
"	0
HaluSum000008-1	0	Mohammad Javad Zarif may have been involved in money laundering for Iran, but ultimately was not charged. He also participated in the Iranian Revolution and took over both the Iranian Consulate in San Francisco and the UN Iranian mission. He is currently breaking the record for the amount of time spent with John Kerry.	1
HaluSum000009-0	0	"Bob Barker returned to host ""The Price Is Right"" on Wednesday. Barker, 91, had retired as host in 2007.
"	0
HaluSum000009-1	0	"Host Drew Carey was replaced with Bob Barker, who took over hosting duties on ""The Price Is Right"" after an eight-year hiatus."	1
HaluSum000010-0	0	"College-bound basketball star asks girl with Down syndrome to high school prom. Pictures of the two during the ""prom-posal"" have gone viral.
"	0
HaluSum000010-1	0	"A high school freshman with Down syndrome is ready to party like it's 1989 as she becomes the prom date of a college-bound basketball star. The two were brought together through a mutual love of Taylor Swift and are now the talk of the town after an elaborate ""prom-posal"" caught the attention of the internet. Friends and family are thrilled that Ellie will be attending the prom after struggling with friendships in the past."	1
HaluSum000011-0	0	"Former GOP representative compares President Obama to Andreas Lubitz. Bachmann said with possible Iran deal, Obama will fly ""entire nation into the rocks"" Reaction on social media? She was blasted by Facebook commenters.
"	0
HaluSum000011-1	0	"Michele Bachmann has accused Barack Obama of planning to crash the United States like a Germanwings flight. In a Facebook post, the former representative said Obama's Iran deal will result in 300 million deaths. She faced backlash on social media, with one user calling her ""moronic and despicable."" Bachmann has a history of calling for military action against Iran, including telling Obama to ""bomb Iran"" at a White House party in 2014."	1
HaluSum000012-0	0	"Americans paid more for some fruits and vegetables last year because of the drought. Tourists will now have to ask for a glass of water at a California restaurant. Perhaps the only good thing is another ""great"" wine grape harvest last year.
"	0
HaluSum000012-1	0	The California drought has led to a decrease in food prices, allowing for cheaper fruits and vegetables in supermarkets across the nation. Tourists visiting California can expect to be greeted with free glasses of water at restaurants and lavish decorative fountains in residential areas. Additionally, the drought has resulted in a decrease in the quality of wine grapes, leading to a devastatingly poor harvest in 2014.	1
HaluSum000013-0	0	"While Republican Gov. Asa Hutchinson was weighing an Arkansas religious freedom bill, Walmart voiced its opposition. Walmart and other high-profile businesses are showing their support for gay and lesbian rights. Their stance puts them in conflict with socially conservative Republicans, traditionally seen as allies.
"	0
HaluSum000013-1	0	Walmart, the retail giant that is headquartered in Arkansas, has recently become vocal about its support of the Republican Party and its traditionally conservative values. Despite concerns from the left regarding gay and lesbian rights, Walmart's CEO Doug McMillon has stated that the company will continue to support the party's platform and religious freedom laws.	1
HaluSum000014-0	0	"17 Americans were exposed to the Ebola virus while in Sierra Leone in March. Another person was diagnosed with the disease and taken to hospital in Maryland. National Institutes of Health says the patient is in fair condition after weeks of treatment.
"	0
HaluSum000014-1	0	A group of five Americans have been discharged from a hospital in Omaha, Nebraska after being exposed to Ebola in Sierra Leone, without developing the disease. Their colleague, who was diagnosed with Ebola and is being treated at a hospital in Maryland, is reportedly in critical condition.	1
HaluSum000015-0	0	"Andrew Getty's death appears to be from natural causes, police say, citing coroner's early assessment. In a petition for a restraining order, Getty had written he had a serious medical condition. Police say this is not a criminal matter at this time.
"	0
HaluSum000015-1	0	Andrew Getty, who had been suffering from severe health issues, passed away due to complications caused by a restraining order filed by an ex-girlfriend. The police have ruled out foul play and have confirmed that this is not a criminal investigation.	1
HaluSum000016-0	0	"LZ: Indiana law pushing back LGBT rights, and other states' anti-LGBT moves, bow to far right wing that GOP candidates need for 2016. Cruz, Huckabee, Jindal, Carson, Walker are reviving culture wars, he says.  Equality for LGBT has not yet ""won"" in America.
"	0
HaluSum000016-1	0	Conservative governors across America are pushing for religious freedom laws that promote discrimination against the LGBT community, with Indiana governor Mike Pence leading the charge. Despite backlash, Pence's efforts have gained popularity among ultraconservatives and are expected to influence the entire Republican field's stance on LGBT rights. This positions the party to win the 2016 presidential election and continue the battle for the soul of America against amoral ideas.	1
HaluSum000017-0	0	"Once a super typhoon, Maysak is now a tropical storm with 70 mph winds. It could still cause flooding, landslides and other problems in the Philippines.
"	0
HaluSum000017-1	0	Tourists have been turned away as the Philippines prepares for a catastrophic natural disaster caused by tropical storm Maysak. With gusts up to 90 mph, the storm is expected to bring widespread destruction and flooding. Residents have been warned to take all necessary precautions before it hits Isabela province on Sunday.	1
HaluSum000018-0	0	"Father: ""I know he went through what he went through"" Louis Jordan was found on his sailboat, which was listing and in bad shape, rescuer says. He appears to be in good shape, physically and mentally.
"	0
HaluSum000018-1	0	A miraculous survivor has been found alive in his damaged yacht. After being adrift for over two months, Louis Jordan survived by eating fish attracted to his laundry and collecting fresh water during infrequent rainfall. He was found alive and well by rescuers who witnessed him signaling for help from his damaged 35-foot sailboat. Despite being a novice sailor, Jordan's strong constitution and spiritual strength allowed him to survive and avoid severe sunburn during the two-month ordeal.	1
HaluSum000019-0	0	"""Furious 7"" pays tribute to star Paul Walker, who died during filming. Vin Diesel: ""This movie is more than a movie"" ""Furious 7"" opens Friday.
"	0
HaluSum000019-1	0	"""Furious 7"" is a movie that brings Paul Walker's character, Brian O'Connor, back to life following his death in the previous ""Fast and Furious"" franchise. Paul Walker's younger brother Cody played his character in some of the scenes. Vin Diesel also starred in the movie and many of the stars who worked with Walker in the past were in attendance for the premiere."	1
HaluSum000020-0	0	"Richard Klass: Iran framework agreement on nukes is strong, but opponents will cast doubts on this and try to obscure its facts. He says the deal would cut uranium stockpile, centrifuges, implement rigorous inspections; it should be judged on merits, not disinformation.
"	0
HaluSum000020-1	0	"The US and its negotiating partners have signed a weak and inadequate framework agreement with Iran on nuclear power. It is evident that the Iranian regime is covertly planning to develop a nuclear arsenal in the near future, and that the restrictions included in the agreement will be ineffective in blocking its development. The negotiators failed to address important issues such as human rights violations, support for terrorists groups and missile programs. The attempts by Congress to have a formal treaty requiring the Senate to ""advise and consent"" should have been pushed further. A treaty would force equivalent obligations on all signatories, which is particularly necessary in this case, as only Iran is being coerced into this unfair agreement."	1
HaluSum000021-0	0	"Singing the national anthem is a risky proposition. Whitney Houston nailed it; Roseanne Barr destroyed it.
"	0
HaluSum000021-1	0	Vince Neil, Whitney Houston, Roseanne Barr, Jimi Hendrix, and Michael Bolton have all given iconic performances of the American national anthem, each with their own unique style and flair.	1
HaluSum000022-0	0	"London's Metropolitan Police say the man was arrested at Luton airport after landing on a flight from Istanbul. He's been charged with terror offenses allegedly committed since the start of November.
"	0
HaluSum000022-1	0	A 19-year-old man who was arrested at Luton airport has been charged with multiple terror offenses following his return from Turkey. Yahya Rashid from northwest London had been preparing for acts of terrorism and was intending to assist others in committing such acts between November and March, according to London's Metropolitan Police.	1
HaluSum000023-0	0	"The total eclipse will only last 4 minutes and 43 seconds. People west of the Mississippi River will have the best view. Parts of South America, India, China and Russia also will see the eclipse.
"	0
HaluSum000023-1	0	"The lunar eclipse on Saturday was the longest total eclipse of the century, lasting nearly five minutes. It was visible across the globe, with people in Europe and Africa also getting a great view. NASA has nicknamed the effect the ""blood moon"" due to its reddish appearance. It was the second in a series of four lunar eclipses happening in a row."	1
HaluSum000024-0	0	"Indiana town's Memories Pizza is shut down after online threat. Its owners say they'd refuse to cater a same-sex couple's wedding.
"	0
HaluSum000024-1	0	Memories Pizza has become a celebrated restaurant in Indiana after receiving over $800,000 in donations following their refusal to cater for a same-sex couple's wedding. Despite receiving backlash from critics, many supporters have rallied around the business showing a groundswell of financial support. Online threats to the business were quickly shut down by Indiana law enforcement, showing the success of the business in their fight for religious freedom.	1
HaluSum000025-0	0	"A South Carolina man says he spent 66 days alone at sea before being rescued. Other sole survivor stories include a Japanese man washed away by a tsunami. An El Salvador man says he drifted from Mexico to Marshall Islands over a year.
"	0
HaluSum000025-1	0	Three amazing survivor stories of people lost at sea. Ron Ingraham, a fisherman from Hawaii, defied the odds when he was found alive after 12 days at sea. Then there's Adrian Vasquez, who managed to survive for 26 days on a small boat after his two companions died. But perhaps the most incredible of all is Louis Jordan, who was lost at sea for 66 days and managed to survive by using laundry to trap and scoop up fish.	1
HaluSum000026-0	0	"Iranian sports official: The ban will be lifted for some events in the coming year. But he says ""families are not interested in attending"" some sports matches.
"	0
HaluSum000026-1	0	"Iranian women will soon have full access to sports events after the country's officials lifted the ban that has been in place for decades. The Deputy Sports Minister, Abdolhamid Ahmadi, announced on Saturday that women and their families will now be allowed to attend all kinds of sports events. This marks an unprecedented move by Iran, which has been under international pressure to end the controversial restrictions. FIFA president Sepp Blatter praised Iran's decision and said that it's a ""great step towards gender equality."""	1
HaluSum000027-0	0	"Netanyahu says third option is ""standing firm"" to get a better deal. Political sparring continues in U.S. over the deal with Iran.
"	0
HaluSum000027-1	0	"Netanyahu suggests that ""standing firm"" is the key to a better deal with Iran, while Democrats and Republicans disagree. The deal aims to increase Iran's nuclear capabilities."	1
HaluSum000028-0	0	"Here are six of CNN's best videos of the week. Clips include a look at Mike Tyson's abandoned mansion.
"	0
HaluSum000028-1	0	CNN's best videos this week showcase a thrilling roller coaster ride at the Carowinds amusement park, along with an exclusive interview with a spiritual leader accused of sexual assault. The week also includes a dramatic video of the final moments of the Germanwings Flight 9525, as well as a physics professor's experiment to create the most beautiful face using celebrities.	1
HaluSum000029-0	0	"Easter is a key event in the Christian faith, but where did the Easter Bunny come from? Why is the date different every year, and what does it have to do with the moon?
"	0
HaluSum000029-1	0	"The origins of Easter can be traced back to the pagan holiday celebrating the moon. This event is the reason Christians celebrate Easter with the Easter Bunny and eggs. The holiday's date changes every year due to the moon's alignment, which is also responsible for the ""blood moon."" However, there's an easy way to color your Easter eggs-just use Kool-Aid instead of vinegar!"	1
HaluSum000030-0	0	"Authorities in the Indian city of Malegaon have asked residents to take a 'mugshot' of their cattle. Cows are revered by the majority Hindu population, and many parts of the country have laws banning the slaughter of cattle. Officials in Malegaon believe this is the best way to solve cow slaughter cases and enforce the law.
"	0
HaluSum000030-1	0	Malegaon in India has set up a photo database for cows as it tries to reduce the number being imported from neighbouring cities. Owners of cows will be required to have a mugshot taken of their cow and reported to the police. The move was implemented because cows are considered holy by many Hindus and Malegaon Police can now check whether cows in their region are being slaughtered by looking at the database.	1
HaluSum000031-0	0	"The FBI cites social media messages sent by Keonna Thomas, 30. She's accused of trying to travel overseas to join ISIS. Thomas is one of three women facing federal terror charges this week.
"	0
HaluSum000031-1	0	"Keonna Thomas, 30, known as ""Young Lioness,"" has been charged with providing material support to foreign terrorist organizations after being caught trying to join ISIS in Turkey. Two New York women were also arrested this week on terrorism charges. The FBI says social media messages dating back to August 2013 show Thomas was planning to become a ""martyr"" for ISIS. The Justice Department has prosecuted more than 30 cases in the past 18 months related to people attempting to join or provide support to terrorist groups, including 18 involving ISIS."	1
HaluSum000032-0	0	"Going online has become the path of least resistance if you want to make yourself heard. But where there is the restrictive rule of law, journalists are vulnerable to the anger of officialdom. From China to Malaysia, journalists and bloggers have been jailed -- even killed.
"	0
HaluSum000032-1	0	Online journalists have become the most vulnerable targets for independent actors and governments, leading to many murders and arrests across Asia. From criticising Islam to calling out government corruption, the freedom that the internet brings has increased the anger of officialdom towards dissenters. Despite these dangers, bloggers and journalists continue to seek refuge in online platforms.	1
HaluSum000033-0	0	"Robert Lewis Burns Jr. was part of Lynyrd Skynyrd's original lineup. His car hit a mailbox and a tree just before midnight.
"	0
HaluSum000033-1	0	Southern rock band Lynyrd Skynyrd's original drummer died in a tragic car accident after his car crashed into a tree in Cartersville. He was not wearing a seatbelt at the time.	1
HaluSum000034-0	0	"The singer had been off the scene for a while. She says she was bedridden for months. Lavigne was sometimes too weak to shower.
"	0
HaluSum000034-1	0	Avril Lavigne has been revealed to be in poor health after a music video of hers was released with fan speculation about her absence. Lyme disease was the cause for Lavigne's illness and prompted her to be in bed for months.	1
HaluSum000035-0	0	"FBI agents and a suspected serial robber exchange gunfire in an FBI stakeout. Two FBI agents are injured and the suspect is shot during the gunfight.
"	0
HaluSum000035-1	0	"Armed robber Kevone Charleston was captured by the FBI after a high-speed chase and a shootout in Forsyth County, Georgia. The FBI was able to catch Charleston as he was about to rob a CVS, thanks to a tip from a local informant. Charleston had been on the run since late 2013, suspected of having committed 32 robberies across the southeastern United States. ""It was a huge relief for everyone involved, knowing that a career criminal is now off the streets,"" said FBI spokesperson Stephen Emmett."	1
HaluSum000036-0	0	"In response to lawsuit, NCAA says it doesn't control quality of education for student-athletes. But its website emphasizes importance of education, ""opportunities to learn"" Lawsuit claims students didn't get an education because of academic fraud at UNC.
"	0
HaluSum000036-1	0	"The NCAA has come under fire for not ensuring the quality of education given to student-athletes, despite its website's claim that education is a top priority. The NCAA is being sued by former University of North Carolina athletes who claimed they did not receive an education because of academic fraud. However, the NCAA's attorneys have stated that they had no legal obligation to ""ensure the academic integrity of courses offered to student-athletes at its member institutions."" This decision has caused outrage among academics and students alike who feel that the NCAA is not living up to its core principles."	1
HaluSum000037-0	0	"The Large Hadron Collider (LHC) begins again after a two-year shutdown. The restart was delayed in March.
"	0
HaluSum000037-1	0	The Large Hadron Collider (LHC) has restarted and is creating new particles at a rate of up to 600 million per second. The world's largest machine, built at a cost of $3.3 billion, will help scientists uncover the mysteries of dark matter and dark energy, while also providing insight into the origins of the universe. Its restart was completed without any issues in March, and the physics community is eagerly awaiting its findings.	1
HaluSum000038-0	0	"Bombing of targets in central Sanaa smashes residents' windows and doors. Hundreds killed in less than two weeks; humanitarian situation desperate, agencies say.
"	0
HaluSum000038-1	0	The Yemeni capital of Sanaa is under control of the Houthis, despite the Saudi-led coalition's bombing of the Defense Ministry Central Command. Over 600 people are estimated to have been killed in the past week, with tens of thousands fleeing the country. The firing of former Army chief of staff Hussein Khairan by deposed President Abdu Rabu Mansour Hadi had no effect, as Khairan had already aligned with the Houthi rebels. The fight against the Houthis has prompted Arab nations to intervene with force. Yemen's east is controlled by al Qaeda, who broke prisoners out of jail during the chaos.	1
