EncounterID	SentenceID	Sentence	IsHallucination
HaluSum000362-1	0	Italy, unlike other countries, has poorly-managed its heritage sites that it is unable to keep them up to a good standard. Despite boasting the highest number of UNESCO World Heritage sites in the world, many of them are at risk of crumbling to the ground due to neglect and lack of public resources. Italy could live off of tourism if it would change its cheap culture and have more fees for visitors to enter popular sites. To generate revenue, Italian monuments could be leased to private companies or sold to foreign investors who get to run them for 50 years.	1
HaluSum000363-0	0	"New neighborhood named Carlsberg City set to emerge in Copenhagen, Denmark. District has been built on site of beer company's former brewery.
"	0
HaluSum000363-1	0	"Copenhagen's Carlsberg City will soon be known for its unique combination of sporting, cultural and educational spaces, as well as residential and business developments in a medieval-like town. Despite being nominated ""Best Master Plan"" at the World Architecture Festival in 2009, it grabbed the world's attention for a different reason. The skateboarding and biking trails, national football team for homeless, and climbing forests made some think it was a theme park. Located near the Carlsberg brewery - traditionally ""more than a beer"" to Danes - the authentic Carlsberg brand and experience center is now open."	1
HaluSum000364-0	0	"The wildfire started in Miami-Dade County on Sunday. By Monday night, it had grown to nearly 2,000 acres. The fire was 50% contained, officials said.
"	0
HaluSum000364-1	0	Miami-Dade County is currently covered in smoke due to a wildfire that has grown from a nonthreatening grass fire to nearly 2,000 acres in less than 24 hours. Emergency responders scrambled to contain the flames, leading to the evacuation of a local school and considerations for road closures. Despite their best efforts, the fire remains 50% uncontained.	1
HaluSum000365-0	0	"A small boat carrying about 50 migrants left from the area of Le Borgne, west of Cap-Haitien Wednesday. It got caught in bad weather on its way to Turks and Caicos.
"	0
HaluSum000365-1	0	A tragic accident claimed the lives of 21 people after their boat hit a reef off the coast of Haiti. Rescuers were only able to save a few passengers, while the rest perished in the stormy waters of the Caribbean Sea.	1
HaluSum000366-0	0	"Photographer Andres Figueroa spent a week in one of the driest places on Earth. He took portraits of Chileans who dress up in costume for popular religious festivals.
"	0
HaluSum000366-1	0	Andres Figueroa captures extraterrestrial-like festivals in South America's Atacama Desert using his mobile lighting studio. The festivals, influenced by European, Incan, and Chinese traditions, inspire Andean communities to come together in love and protection against social problems.	1
HaluSum000367-0	0	"Dr. Seuss' new book, ""What Pet Should I Get?"" will have a first printing of 1 million copies. The publisher released a never-before-seen image from inside the book by Theodor Geisel.
"	0
HaluSum000367-1	0	"The highly anticipated release of Dr. Seuss' ""What Pet Should I Get?"" has caused a frenzy, with pre-orders skyrocketing and the book's first printing being increased from 500,000 to 1 million copies. The book features a new character, a mischievous cat who gets into all sorts of trouble. The image released by the publisher shows the cat causing chaos in a pet shop as the siblings try to decide on their new pet."	1
HaluSum000368-0	0	"Boston Marathon takes place Monday, two years after bombing, and sentencing phase of trial begins Tuesday. Kayyem: It wasn't the Puritan ethic but good disaster response that kept the marathon bombing from being even worse.
"	0
HaluSum000368-1	0	The Boston Marathon bombing trial was deemed a success, and it has been suggested that the US judicial system is fully equipped for terrorism trials. It was due to the skills of the emergency crews that there were no further deaths, and this was the main focus of crisis planning following the attack. It is important to review incidents such as this to learn from them and improve resilience.	1
HaluSum000369-0	0	"O'Malley using YouTube to test out attack lines. How Clinton's new hire could help keep the Obama coalition together. Republican concerns about the new 2016 primary calendar.
"	0
HaluSum000369-1	0	Hillary Clinton may not have the support of President Obama, as she seems to echo the views of Republicans. A new Democratic candidate for 2016, Martin O'Malley, has used YouTube to promote his message and criticize Clinton's position on various issues. Also, Jeb Bush and Marco Rubio are at risk of losing the nomination to evangelical figures such as Mike Huckabee and Ted Cruz due to changes in the primary calendar.	1
HaluSum000370-0	0	"Parents of Martin Richard argue against death penalty for Dzhokhar Tsarnaev. The 8-year-old boy was youngest of victims in the Boston Marathon bombings. Sentencing phase for Tsarnaev begins next week.
"	0
HaluSum000370-1	0	The family of Martin Richard, who died in the 2015 attack, has pleaded to not enforce the death penalty on Dzhokhar Tsarnaev, who has been convicted of the charges. They want the government to allow Tsarnaev to be behind bars for the rest of his life and not leave him with any right to appeal for his freedom.	1
HaluSum000371-0	0	"AC/DC drummer Phil Rudd pleads guilty to threatening to kill and drug charges. Court summary revealed that Rudd had ordered for his personal assistant to be ""taken out"" Police found methamphetamine and cannabis in his New Zealand home in November.
"	0
HaluSum000371-1	0	Phil Rudd, the drummer for the world-famous rock band AC/DC, has been cleared of all charges relating to drug possession and threatening to kill his personal assistant. The charges were reportedly an over-reaction to a dispute about Rudd's flopped solo album, and his assistant was never actually in any danger. Despite the drama, Rudd remains an icon in the world of rock music.	1
HaluSum000372-0	0	"Miller: While the U.S. entangles itself in the nuclear negotiations, Iran is gaining a freer hand to assert its regional influence. He says United States is being outfoxed, not outgunned.
"	0
HaluSum000372-1	0	Iran is becoming a global superpower while the US flounders in its attempts to gain control in the Middle East, according to Miller. The US is losing support from its allies and making enemies with Iran, who is quickly gaining new friends with their expanding global influence. The US has no clear plan for dealing with ISIS and is only further enabling Iran's dominance in the region. The nuclear deal will only serve to make Iran more powerful in the world, rather than putting constraints on their behavior.	1
HaluSum000373-0	0	"An estimated 50,000 Americans are newly infected with HIV each year, CDC says. Kevin Robert Frost: Syringe exchange programs save millions in HIV treatment costs.
"	0
HaluSum000373-1	0	Syringe exchange programs have caused a spike in HIV and hepatitis C infections among injection drug users in rural Indiana and Kentucky, despite overwhelming scientific evidence that they are effective in preventing the spread of disease. The recent national spotlight on syringe services programs offers a critical opportunity for us to revisit the notion that these programs promote and encourage drug use. Congress should reinstate the ban on federal funding for these programs to prevent a nationwide resurgence of HIV and hepatitis C infections through injection drug use.	1
HaluSum000374-0	0	"The NuvaRing is one of the most popular birth control products on the market. Lawsuit cites ""a heightened risk of blood clots associated with the use of NuvaRing"" Maker: ""There is substantial evidence to support the safety and efficacy of NuvaRing""
"	0
HaluSum000374-1	0	The NuvaRing has been found to cause life-threatening blood clots in women who use it, despite the manufacturer claiming otherwise. Lawsuits filed against Merck, the current manufacturer, allege that the original manufacturer, Organon, did not properly warn consumers of the risks associated with NuvaRing. The Langhart family, who lost their daughter to complications from using the contraceptive, have created a nonprofit to inform women of the comparative risks of all forms of hormonal contraceptives.	1
HaluSum000375-0	0	"The newly discovered species looks a lot like Kermit. You can see its internal organs through the translucent skin on its belly.
"	0
HaluSum000375-1	0	Costa Rica has recently discovered a new species of frog that shares a striking resemblance to Kermit the Frog. Known as Hyalinobatrachium dianae, or simply H. dianae, it has become a popular topic in the scientific community due to its translucent belly, which allows you to see its internal organs. The discovery is considered an important milestone as Costa Rica has only found 14 species of glass frogs before.	1
HaluSum000376-0	0	"Three rabbis found guilty of conspiracy to commit kidnapping in New Jersey federal court. They were accused of orchestrating kidnapping, torture of Jewish men who refused to allow their wives a religious divorce. Lawyers for the rabbis said they plan on appealing the verdicts.
"	0
HaluSum000376-1	0	Orthodox rabbis were convicted of kidnapping Jewish men who refused to divorce their wives. They were found guilty of conspiring to commit kidnapping in New Jersey federal court. Their lawyers are planning to appeal the verdicts.	1
HaluSum000377-0	0	"A Massachusetts jury is deliberating Hernandez's case. Hernandez is charged with first-degree murder in the killing of Odin Lloyd.
"	0
HaluSum000377-1	0	Aaron Hernandez, a former New England Patriots star, is on trial in Massachusetts for murdering Odin Lloyd less than a mile from his own home. Defense lawyers have argued that there is no evidence to suggest Hernandez had any reason to kill his friend and future brother-in-law. Prosecution has called Hernandez cold and calculating, describing him as a man who can kill someone simply for disrespecting him in public. Hernandez has been shown on camera holding a .45-caliber handgun, the same type of weapon that was used to kill Lloyd. Hernandez faces other murder charges in a separate case.	1
HaluSum000378-0	0	"James Best, who played the sheriff on ""The Dukes of Hazzard,"" died Monday at 88. ""Hazzard"" ran from 1979 to 1985 and was among the most popular shows on TV.
"	0
HaluSum000378-1	0	"The beloved actor James Best passed away on Monday after a successful career on both stage and screen. Despite his many roles, Best will be remembered for his charm and wit as the character of Rosco P. Coltrane in ""The Dukes of Hazzard"", a show that captivated audiences for years. His legacy will live on in the hearts of those who laughed with him and loved him."	1
HaluSum000379-0	0	"The crashed plane was a Cessna 414, National Transportation Safety Board reports. Coach Torrey Ward, administrator Aaron Leetch among the 7 killed in the crash. The plane crashed while coming back from the NCAA title game in Indianapolis.
"	0
HaluSum000379-1	0	A plane carrying Torrey Ward, Aaron Leetch and five others crashed in Bloomington, Illinois, killing all on board. The plane was on its way to an NCAA volleyball tournament in Springfield, Missouri.	1
HaluSum000380-0	0	"An artist apologizes for his Lucille Ball statue. In a public letter, the sculptor offers to pay for fixes to the statue. The mayor says he's not interested in having the original artist work on the statue.
"	0
HaluSum000380-1	0	"New York town rejects artist's offer to fix ""Scary Lucy"" statue, despite apology. Artist Dave Poulin has been trying to remove the unsettling sculpture for years, but Celoron officials are looking for a new sculptor to fix it. The controversy over the statue has sparked a nearby town to consider their own tribute to Lucille Ball."	1
HaluSum000381-0	0	"To understand Thursday's attack, one must understand that Kenya and Al-Shabaab are at war. Al Qaeda's 1998 attack on the U.S. Embassy is the single largest, but Al-Shabaab have killed many more Kenyans.
"	0
HaluSum000381-1	0	Al-Shabaab have been responsible for many attacks on Kenya over the years, including the 1998 bombing of the U.S. Embassy in Nairobi that killed over 200 people. Despite this, the extremist group has continued to target Kenya, leading to a bloody and ongoing conflict between the two sides. Kenya's military has launched multiple offensives against the group, but Al-Shabaab has responded with increasingly deadly attacks on Kenyan soil, with the most recent attack being the massacre of 147 people at a college campus in Garissa.	1
HaluSum000382-0	0	"Al Qaeda fighters attack a prison and other government buildings, freeing many prisoners. Government troops clash with the fighters, most of whom flee. Yemen is descending into chaos as a Shia-Sunni conflict draws in regional rivals Saudi Arabia and Iran.
"	0
HaluSum000382-1	0	Al Qaeda militants, led by Khaled Batarfi, freed 270 prisoners from a Yemeni jail, including those with Al Qaeda links after seizing control of government buildings including a radio station and city's central prison. The conflict in Yemen escalated following the ousting of Sunni President Abdu Rabu Mansour Hadi and the Houthi uprising. Saudia Arabia has launched airstrikes and the situation risks becoming a proxy war between it and Shiite rivals Iran. AQAP controls parts of eastern Yemen.	1
HaluSum000383-0	0	"5,500 signatures call for Jedi temple after similar petition asked for campus mosque. Petition started by a student at Dokuz Eylul University in the western province of Izmir.
"	0
HaluSum000383-1	0	Students in Turkey are demanding a Jedi temple be built on campus due to a shortage of Jedi on Earth. The petition has gained almost 5,500 supporters and calls for a balance in the Force. The satirical document also serves as a serious response to a petition for a mosque on campus, which gained almost 200,000 supporters. The proposal for a Buddhist temple on campus also received over 20,000 signatures. The debate around civil and religious freedoms continues in Turkey, with accusations of attempts to instill conservative Islamic values by the government.	1
HaluSum000384-0	0	"Frances Bean Cobain, daughter of the late Kurt Cobain, spoke to Rolling Stone about a new film on the Nirvana frontman. 22-year-old Cobain is an executive producer of the documentary ""Montage of Heck"" She describes growing up with the legacy of her father looming large.
"	0
HaluSum000384-1	0	Frances Bean Cobain talks about her experience as an intern at Rolling Stone, where she worked on a cover story about the Jonas Brothers. She also discusses her love for Henry Miller's work ethic and how she is now focused on pursuing her art.	1
HaluSum000385-0	0	"U.N. agency says 900 refugees from Yemen have arrived in Horn of Africa, asks ships in area to be vigilant. WHO: At least 643 people have been killed, more than 2,000 injured in three weeks. UNICEF: Aid includes medical supplies for up to 80,000 people and more airlifts are planned.
"	0
HaluSum000385-1	0	UNICEF airlifts medical supplies to Yemen to help 80,000 people, while UNHCR warns about the dangers of fleeing across the Red Sea and Gulf of Aden. WHO estimates that 643 people have been killed and 2,226 injured in Yemen since fighting escalated three weeks ago.	1
HaluSum000386-0	0	"CF-18 Hornets bomb a garrison near ISIS' de facto capital of Raqqa, Canada says. The Canadian military has conducted dozens of strikes against ISIS in Iraq.
"	0
HaluSum000386-1	0	Canadian fighter jets carried out a successful strike on an ISIS stronghold in Syria, causing numerous casualties and significant damage to the militant group. The Canadian military's swift action demonstrates its commitment to fighting against terrorist threats and ensuring international security and stability.	1
HaluSum000387-0	0	"Officer Michael Slager's mother says she couldn't watch the video of the incident. Slager was fired earlier this week. Slager is charged with murder in the death of Walter Scott.
"	0
HaluSum000387-1	0	The fired North Charleston police officer Michael Slager, who is now charged with murder after killing Walter Scott, was a model officer with a clean record, passing all his trainings and certifications with flying colors. His mother, Karen Sharpe, is completely shocked and denies that her son had the character to commit such an act.	1
HaluSum000388-0	0	"Quarter million people without power in Sydney and nearby areas. A large storm system brought damaging winds and flooding to parts of Australia. The flooding is affecting public transportation services, residential and coastal areas.
"	0
HaluSum000388-1	0	"The intense low pressure system in Australia brought dangerous conditions that have resulted in thousands being isolated and four deaths. The flooding has caused significant disruptions to public transportation and schools in the New South Wales area. The storm was described as ""once in a decade"" and has caused major havoc in and around Sydney."	1
HaluSum000389-0	0	"A sexual harassment complaint has been filed against PM John Key after a waitress complained about him repeatedly pulling her ponytail. Kiwi Prime Minister accused of pulling a waitress' hair on several occasions despite her obvious discomfort. PM Key later apologized, but said that he was merely engaging in ""banter"" Politicians and public figures have condemned his behavior.
"	0
HaluSum000389-1	0	New Zealand Prime Minister John Key has been accused of sexual harassment after repeatedly pulling a waitress' ponytail. However, Key has denied these allegations and said that he never even interacted with the waitress. Despite multiple witnesses and evidence to the contrary, Key remains adamant that he is innocent. The public has expressed outrage over the incident, calling for Key to step down from his position.	1
HaluSum000390-0	0	"The GoFundMe campaign has already topped its $75,000 goal. Justin Griner, the dad of ""Success Kid,"" needs a kidney transplant.
"	0
HaluSum000390-1	0	"The family of ""Success Kid"" is celebrating their successful search for a donor to provide a kidney for Justin Griner."	1
HaluSum000391-0	0	"Three of the five teens released. One 18-year-old suspect has been charged, report says. Australian police said the suspects were allegedly planning an ""ISIS-inspired"" attack.
"	0
HaluSum000391-1	0	Australia's Federal Police have arrested five ISIS elements, two of which have been detained, and three of them have been released. Prime Minister Tony Abbott announced that the group was planning to attack a major national commemoration event. The best way for Australians to deal with this threat is to live their lives as normal, and not to let the terrorists get to them.	1
HaluSum000392-0	0	"Jury selection for the Aaron Hernandez trial started back in January. The jury began its deliberations on Tuesday. The case has a complicated cast of characters.
"	0
HaluSum000392-1	0	Aaron Hernandez is on trial for the murder of Odin Lloyd and two others, Daniel de Abreu and Safiro Furtado, who were killed outside a Boston nightclub. Hernandez's mother, Terri Hernandez, was deeply involved in her son's sports training before her unexpected death. District Attorney Samuel Sutter, who is leading the prosecution, is also the newly elected mayor of Fall River.	1
HaluSum000393-0	0	"ESPN reporter Britt McHenry caught on video berating a towing company employee. CNN's Kelly Wallace used the story as a teachable moment for her daughters. Wallace: McHenry could learn from other celebrities who responded gracefully in stressful situations.
"	0
HaluSum000393-1	0	CNN journalist Kelly Wallace teaches her daughters the importance of being respectful to others after a towing company employee posted a video of ESPN reporter Britt McHenry insulting her. McHenry apologized on Twitter but was later fired from her job. Wallace uses examples of other celebrities who handled similar situations with grace and dignity to show her daughters how to handle stressful situations without insulting others.	1
HaluSum000394-0	0	"Alfred Taubman, who died Friday, was active in philanthropy and worth an estimated $3.1 billion. Amid suburban boom of the '50s, he realized people would need places to shop: ""...we couldn't miss"" We was convicted in 2002 of trying to rig auction house commissions; he maintained he was innocent.
"	0
HaluSum000394-1	0	Alfred Taubman, one of the largest real estate developers in history, died at the age of 91. He is known for building several shopping malls and retail stores after realizing people needed places to shop. After being convicted of trying to rig auction house commissions in 2002, he was sent to jail. However, Taubman managed to maintain his innocence throughout the trial.	1
HaluSum000395-0	0	"Waters in a huge area of the Pacific are running 5.5 degrees warmer than normal. Marine life that likes cooler water has moved and others that like warm seas are seen in new places. ""The Blob"" might be having an effect on rain and snow -- and the West Coast drought.
"	0
HaluSum000395-1	0	"""The Blob,"" an ominous and dangerous area of hot water in the Pacific Ocean, has caused a significant increase in water temperature that has led some fish to migrate hundreds of miles from their normal habitats in search of cooler waters. This warm water has also led to a decrease in snowfall in areas that usually experience feet of snow, such as California, Oregon and Washington, due to a persistent ridge of high pressure that has kept the West dry and warm. Additionally, the blob has contributed to a record number of wildfires in the region, and has caused rising air, which has led to more thunderstorms and even colder weather in the Midwest and East."	1
HaluSum000396-0	0	"Tristan da Cunha holds competition for architects and designers. Islands are most isolated inhabited archipelago on earth.
"	0
HaluSum000396-1	0	"The UK's Royal Institute of British Architects is holding an international competition for the ""world's most sustainable island."" The winner will be selected to help develop renewable energy systems, modern housing and cost-effective agrarian systems for the archipelago's 270 residents. Some of the design challenges include: how to get materials to the island, how to assemble the structures, how to make all structures more energy efficient, and how to modernize government structures."	1
HaluSum000397-0	0	"Police questioned the group about an alleged assault of a Walmart employee. A man put a police officer in a headlock and fighting broke out.
"	0
HaluSum000397-1	0	A Christian family band based in Arizona was involved in a dramatic shootout with police officers outside a Walmart store. Peppers spray was used and a chaotic fight broke out. One member of the band was killed and another arrested, while a police officer was injured in the scuffle.	1
HaluSum000398-0	0	"The 100th anniversary of the start of the mass killings will be commemorated Friday. Turkey and others reject the use of the word ""genocide"" Most estimates of the deaths fall between 600,000 and 1.5 million.
"	0
HaluSum000398-1	0	"The Armenian Genocide is viewed differently by Turks and Armenians, as it touches on national identity. Ottoman Turks were worried that Armenians living in the Ottoman Empire would offer wartime assistance to Russia. The number of deaths of Armenians and others is mostly agreed to be around 2 million. Although genocide was not a defined crime at the time, this was the first genocide of the 20th century. Victims died in mass burnings, drownings, torture, gas, poison, disease, and starvation. Some children were loaded into boats and thrown overboard. The first mentions of genocide occurred in media and government communications at the time, with ""genocide"" being a word in circulation. Today, many entities recognize the genocide, including Germany, Armenia, the Vatican, the European Parliament, France, Russia, and Canada."	1
HaluSum000399-0	0	"Larry Upright's family says he would enjoy the request. Some vow to honor it, but others say they'll still vote for Hillary Clinton.
"	0
HaluSum000399-1	0	Staunch Republican Larry Upright, who died at the age of 81, made it clear in his obituary that he did not want anyone voting for Hillary Clinton in the upcoming election. Some people have stated in the online guestbook that they will honor his request, while others are still supporting Clinton.	1
HaluSum000400-0	0	"Hillary Clinton developed a close relationship with the financial world as a New York senator. Clinton's allies there are eager to galvanize a broad network of potential donors. Her coziness with Wall Street irritates liberal activists, who are a growing influence in the Democratic Party.
"	0
HaluSum000400-1	0	Hillary Clinton has officially launched her campaign for the Democratic Party's presidential nomination. She is expected to receive enthusiastic support from the finance industry, which views her as a dependable, business-friendly force. However, her close relationship with Wall Street has become a source of irritation for liberal activists. Clinton has taken on economic issues that most appeal to liberals, such as the wealth gap, minimum wage, and equal pay. Democratic strategists believe Clinton will offer a compelling rationale for her campaign, centered on her biography and middle-class upbringing.	1
HaluSum000401-0	0	"Lewis Hamilton will start on pole in China. Pushed teammate Rosberg into second on the last lap. Rosberg refused to shake Hamilton's hand afterward.
"	0
